{
  "name": "Example Title",
  "delegate_descriptor_id": "500123",
  "default_value": "example_value",
  "settings": "example_value",
  "storage_duration": "example_value",
  "force_lower_case": true,
  "clean_text": true,
  "enabled": true,
  "published": true,
  "dirty": true,
  "revision_number": 10,
  "created_at": "2026-01-15T10:30:00Z",
  "updated_at": "2026-01-15T10:30:00Z"
}